<?xml version="1.0" encoding="utf-8"?>
<conf xmlns:xsi="http://www.w3.org/2001/XMLSchema-instance" xsi:noNamespaceSchemaLocation="./FSter.xsd">
    <!--
    Name: FSter Media library
    Author: Lorenzo Bellini <lorenzo.bellini@itsme.it>
    Owner: itsme srl
    Version: 0.1.20100107

    With this configuration of FSter you can navigate and use media files, that you have on your harddisk, organized by images, audio and video

    -->
    <exposing_tree>
        <root>
            <visualization_policy>
                <content>
                    <static_folder>
                        <visualization_policy>
                            <name value="Audios" />
                            <content>
                                <file>
                                    <visualization_policy>
                                        <self_conditions>
                                            <condition metadata="rdf:type" value="nfo:Audio" />
                                        </self_conditions>
                                        <name value="$self{nie:title}" />
                                        <content>
                                            <real_file metadata="nie:url" />
                                        </content>
                                    </visualization_policy>
                                </file>
                            </content>
                        </visualization_policy>
                    </static_folder>
                    <static_folder>
                        <visualization_policy>
                            <name value="Images" />
                            <content>
                                <file>
                                    <visualization_policy>
                                        <self_conditions>
                                            <condition metadata="rdf:type" value="nfo:Image" />
                                        </self_conditions>
                                        <name value="$self{nfo:fileName}" />
                                        <content>
                                            <real_file metadata="nie:url" />
                                        </content>
                                    </visualization_policy>
                                </file>
                            </content>
                        </visualization_policy>
                    </static_folder>
                    <static_folder>
                        <visualization_policy>
                            <name value="Videos" />
                            <content>
                                <file>
                                    <visualization_policy>
                                        <self_conditions>
                                            <condition metadata="rdf:type" value="nfo:Video" />
                                        </self_conditions>
                                        <name value="$self{nfo:fileName}" />
                                        <content>
                                            <real_file metadata="nie:url" />
                                        </content>
                                    </visualization_policy>
                                </file>
                            </content>
                        </visualization_policy>
                    </static_folder>
                </content>
            </visualization_policy>
        </root>
    </exposing_tree>
    <saving_tree />
</conf>
